{
  "recordStatus": "candidate",
  "captureMethod": "manual",
  "enteredBy": "Codex",
  "enteredDate": "2026-05-30",
  "source": {
    "sourceId": "SRC045",
    "sourceName": "AIATSIS",
    "sourceRecordUrl": "https://aiatsis.gov.au/collection/featured-collections/naidoc-week-posters",
    "sourceIdentifier": "naidoc-week-posters",
    "accessDate": "2026-05-30"
  },
  "sourceMetadata": {
    "sourceTitle": "2021 National NAIDOC Poster Care for Country",
    "sourceCreator": "Maggie-Jean Douglas",
    "sourceCreatorRole": "creator_or_institution_from_target",
    "sourceDateText": "2021",
    "sourcePlaceText": "Australia",
    "sourceObjectType": "poster archive item",
    "sourceHoldingInstitution": "AIATSIS",
    "sourceCollection": "",
    "sourceDescription": "Explicit-license poster with care for country framing",
    "sourceRightsText": "AIATSIS featured collection 2021 entry",
    "sourceRightsUri": "",
    "sourceCreditLine": ""
  },
  "normalizedMetadata": {
    "normalizedTitle": "2021 National NAIDOC Poster Care for Country",
    "normalizedDateStart": 2021,
    "normalizedDateEnd": 2021,
    "normalizedPlace": "Australia",
    "historicalNodeIds": [
      "HN012",
      "HN013",
      "HN015"
    ],
    "movementIds": [],
    "themeTerms": [
      "naidoc_land_rights"
    ],
    "language": ""
  },
  "rights": {
    "rightsState": "image_open",
    "imageUsePolicy": "full_image_allowed",
    "metadataPolicy": "source metadata may be indexed with citation",
    "thumbnailPolicy": "allowed only with source credit and protocol review where applicable",
    "fullImagePolicy": "allowed only when source record and protocol review confirm reuse",
    "localCopyPermitted": false,
    "rightsBasis": "Image presence IMG03. Ingest with license evidence credit restrictions and protocol note. Default policy follows the project rule that image display must be justified by item-level evidence.",
    "rightsReviewRequired": true,
    "rightsReviewer": "",
    "rightsReviewDate": "",
    "rightsNotes": "IMG03 marks open/reusable image evidence, but local copying still remains disabled in draft records."
  },
  "citation": {
    "citationText": "AIATSIS. \"2021 National NAIDOC Poster Care for Country.\" Accessed 2026-05-30. https://aiatsis.gov.au/collection/featured-collections/naidoc-week-posters",
    "citationStyle": "project_draft",
    "citationUrl": "https://aiatsis.gov.au/collection/featured-collections/naidoc-week-posters",
    "accessDate": "2026-05-30"
  },
  "publicationDisplay": {
    "imagePresenceCode": "IMG03",
    "imagePresenceBasis": "ready_manual_open_with_protocol: AIATSIS/NAIDOC page confirms 2021 title creator theme and CC BY-NC-ND license",
    "imageFrameBehavior": "open_image_frame",
    "imageSizePolicy": "template_defined",
    "layoutNote": "Image size is selected by the publication template; IMG code only controls image presence and display permission state."
  },
  "classifications": [
    {
      "classificationType": "first_ingest_scope_cell",
      "classificationValue": "C13",
      "source": "controlled_vocabulary",
      "confidence": "high",
      "reviewer": "Codex",
      "note": "NAIDOC / land-rights posters first-ingest cell"
    },
    {
      "classificationType": "record_family",
      "classificationValue": "poster archive item",
      "source": "controlled_vocabulary",
      "confidence": "medium",
      "reviewer": "Codex",
      "note": "Inherited from first-ingest target selection."
    },
    {
      "classificationType": "image_presence_code",
      "classificationValue": "IMG03",
      "source": "editorial_judgment",
      "confidence": "medium",
      "reviewer": "Codex",
      "note": "Ingest with license evidence credit restrictions and protocol note"
    },
    {
      "classificationType": "historical_node",
      "classificationValue": "HN012",
      "source": "controlled_vocabulary",
      "confidence": "medium",
      "reviewer": "Codex",
      "note": "Inherited from first-ingest scope cell; requires record-level confirmation."
    },
    {
      "classificationType": "historical_node",
      "classificationValue": "HN013",
      "source": "controlled_vocabulary",
      "confidence": "medium",
      "reviewer": "Codex",
      "note": "Inherited from first-ingest scope cell; requires record-level confirmation."
    },
    {
      "classificationType": "historical_node",
      "classificationValue": "HN015",
      "source": "controlled_vocabulary",
      "confidence": "medium",
      "reviewer": "Codex",
      "note": "Inherited from first-ingest scope cell; requires record-level confirmation."
    },
    {
      "classificationType": "movement_or_regional_formation",
      "classificationValue": "RM087",
      "source": "controlled_vocabulary",
      "confidence": "medium",
      "reviewer": "Codex",
      "note": "Inherited from scope cell; may be regional movement rather than canonical MV term."
    },
    {
      "classificationType": "regional_event_node",
      "classificationValue": "REN061",
      "source": "controlled_vocabulary",
      "confidence": "medium",
      "reviewer": "Codex",
      "note": "Inherited from first-ingest scope cell."
    }
  ],
  "relations": [],
  "uncertaintyNotes": [
    {
      "field": "rights",
      "issue": "manual_review_required",
      "displayNote": "Rights state is a conservative draft and must be verified against the source record before publication.",
      "internalNote": "Ingest with license evidence credit restrictions and protocol note"
    },
    {
      "field": "classification",
      "issue": "scope_cell_inherited",
      "displayNote": "Historical classifications are inherited from the first-ingest scope cell until source-level metadata is reviewed.",
      "internalNote": "Explicit-license poster with care for country framing"
    }
  ],
  "image": {
    "sourceImageUrl": "https://aiatsis.gov.au/collection/featured-collections/naidoc-week-posters",
    "imageRightsUri": "",
    "imageRightsLabel": "IMG03",
    "creditLine": "AIATSIS",
    "localCopyPermitted": false
  }
}
